,Sala,Presidente,Ministros,Integrantes,Fecha2,Ministros2,Abogados,Integrante1,Integrante2,Integrante3,Integrante4,Causa1,Causa2,Causa3,Causa4
18094,CUARTA,  BLANCO,  MUÑOZ  CERDA   ,MUÑOZ CERDA  CORREA FIGUEROA ,2015-06-18 00:00:00,,  CORREA  FIGUEROA ,MUÑOZ,CERDA,,CORREA,comisión,,,
18101,CUARTA,  BLANCO,  CHEVESICH MUÑOZ  CERDA ,CHEVESICH MUÑOZ CERDA CORREA,2015-06-22 00:00:00,,   CORREA,CHEVESICH,MUÑOZ,CERDA,CORREA,,,,
18109,CUARTA,  BRITO,  MAGGI CHEVESICH   ,MAGGI CHEVESICH  CORREA FIGUEROA ,,,  CORREA  FIGUEROA ,MAGGI,CHEVESICH,,CORREA,,,,
18118,CUARTA,  BLANCO,  CHEVESICH MUÑOZ   ,CHEVESICH MUÑOZ QUINTANILLA — ,2015-06-24 00:00:00,,   QUINTANILLA —  ,CHEVESICH,MUÑOZ,QUINTANILLA,—,subroga,,,
18128,CUARTA,  BLANCO,  MUÑOZ  CERDA   ,MUÑOZ CERDA  MATUS RODRIGUEZ ,2015-06-25 00:00:00,,  MATUS  RODRIGUEZ ,MUÑOZ,CERDA,,MATUS,comisión,,,
18148,CUARTA,  BLANCO,  CHEVESICH  ARANGUIZ  LOS ,CHEVESICH ARANGUIZ LOS CORREA PRADO ,2015-06-30 00:00:00,,  CORREA  PRADO ,CHEVESICH,ARANGUIZ,LOS,CORREA,comisión,permiso,,
18160,CUARTA,  CISTERNAS,  BLANCO  CHEVESICH  LOS ,BLANCO CHEVESICH LOS LAGOS ,2015-06-09 00:00:00,,  LAGOS   ,BLANCO,CHEVESICH,LOS,LAGOS,comisión,subroga,,
18173,CUARTA,  BLANCO,  CHEVESICH  CERDA  LOS ,CHEVESICH CERDA LOS €KETCHEBERRY ,2015-06-08 00:00:00,,  €KETCHEBERRY   ,CHEVESICH,CERDA,LOS,€KETCHEBERRY,comisión,,,
18199,CUARTA,,  ARANGUIZ  MINISTRO SUPLENTE:  ,ARANGUIZ MINISTRO SUPLENTE: LAGOS ,2015-06-04 00:00:00,,  LAGOS  ,ARANGUIZ,MINISTRO,SUPLENTE:,LAGOS,,,,
18214,CUARTA,  JUICA,  BLANCO  CHEVESICH MUÑOZ,BLANCO CHEVESICH MUÑOZ PIZARRO,2015-06-03 00:00:00,MUÑOZ,   PIZARRO,BLANCO,CHEVESICH,MUÑOZ,PIZARRO,subroga,,,
18230,CUARTA,  BLANCO,  CHEVESICH MUÑOZ   ,CHEVESICH MUÑOZ  PIZARRO ETCHEBERRY ,2015-06-02 00:00:00,,  PIZARRO   ETCHEBERRY ,CHEVESICH,MUÑOZ,,PIZARRO,subroga,,,
18248,CUARTA,  BLANCO,  MUÑOZ  CERDÁA  LOS ABOCADOS ,MUÑOZ CERDÁA LOS ABOCADOS QUINTANILLA ,2015-06-01 00:00:00,,  QUINTANILLA   ,MUÑOZ,CERDÁA,LOS,ABOCADOS,permiso,,,
18251,CUARTA,  BLANCO,  MUÑOZ  CERDA   ,MUÑOZ CERDA  QUINTANILLA MATUS ,,,  QUINTANILLA  MATUS ,MUÑOZ,CERDA,,QUINTANILLA,,,,
18254,CUARTA,  BLANCO,  CHEVESICH MUÑOZ  CERDA,CHEVESICH MUÑOZ CERDA QUINTANILLA ,2015-07-14 00:00:00,CERDA,   QUINTANILLA ,CHEVESICH,MUÑOZ,CERDA,QUINTANILLA,,,,
18260,CUARTA,  BLANCO,  CHEVESICH  CERDA  LOS ,CHEVESICH CERDA LOS ETCHEBERRY ,2015-07-20 00:00:00,,  ETCHEBERRY   ,CHEVESICH,CERDA,LOS,ETCHEBERRY,,,,
18265,CUARTA,  BLANCO,  MUNOZ STOR CERDA   ,MUNOZ STOR CERDA  ETCHEBERRY SEOR CORREA ,2015-07-21 00:00:00,,  ETCHEBERRY  SEOR CORREA ,MUNOZ,STOR,CERDA,,,,,
18271,CUARTA,  BLANCO,  MUÑOZ  CERDA   ,MUÑOZ CERDA  RODRIGUEZ CORREA ,2015-07-22 00:00:00,,  RODRIGUEZ  CORREA ,MUÑOZ,CERDA,,RODRIGUEZ,,,,
18278,CUARTA,  BLANCO,  MUÑOZ  CERDA   ,MUÑOZ CERDA  PIZARRO LAGOS ,2015-07-23 00:00:00,,  PIZARRO  LAGOS ,MUÑOZ,CERDA,,PIZARRO,comisión,,,
18292,CUARTA,  JUICA,  DOLMESTCH  CISTERNAS  LOS ,DOLMESTCH CISTERNAS LOS 85 LAGOS ,2015-07-27 00:00:00,, 85 LAGOS   ,DOLMESTCH,CISTERNAS,LOS,85,licencia,subroga,,
18301,CUARTA,  JUICA,  DOLMESTCH CISTERNAS ,DOLMESTCH CISTERNAS ,2015-07-28 00:00:00,,  ,DOLMESTCH,CISTERNAS,,,,,,
18311,CUARTA,  BLANCO,  CHEVESICH  CERDA  LOS ,CHEVESICH CERDA LOS QUINTANILLA ,2015-07-29 00:00:00,,  QUINTANILLA  ,CHEVESICH,CERDA,LOS,QUINTANILLA,permiso,,,
18322,CUARTA,  BLANCO,  CERDA  MUÑOZ   ,CERDA MUÑOZ  RODRÍGUEZ CORREA ,2015-07-30 00:00:00,,  RODRÍGUEZ  CORREA ,CERDA,MUÑOZ,,RODRÍGUEZ,comisión,,,
18344,CUARTA,,  BLANCO  CHEVESICH ,BLANCO CHEVESICH ,2015-07-09 00:00:00,, ,BLANCO,CHEVESICH,,,,,,
18357,CUARTA,  BRITO,  BLANCO CERDA  LOS ABOGAADOS ,BLANCO CERDA LOS ABOGAADOS PIZARRO CORREA ,2015-07-08 00:00:00,,  PIZARRO  CORREA ,BLANCO,CERDA,LOS,ABOGAADOS,comisión,permiso,,
18371,CUARTA,  BLANCO,   CHEVESICH MUÑOZ —  CERDA,CHEVESICH MUÑOZ — CERDA PIZARRO,2015-07-07 00:00:00,CERDA,   PIZARRO,CHEVESICH,MUÑOZ,—,CERDA,,,,
18386,CUARTA,  BLANCO,   CHEVESICH MUÑOZ —  CERDA,CHEVESICH MUÑOZ — CERDA PIZARRO,2015-07-06 00:00:00,CERDA,   PIZARRO,CHEVESICH,MUÑOZ,—,CERDA,,,,
18416,CUARTA,  BLANCO,  MUNOZ  CERDA   ,MUNOZ CERDA  CORREA PRADO ,2015-07-02 00:00:00,,  CORREA  PRADO ,MUNOZ,CERDA,,CORREA,comisión,,,
18433,CUARTA,  BLANCO,  CHEVESICH MUÑOZ  ,CHEVESICH MUÑOZ ,2015-07-01 00:00:00,,  ,CHEVESICH,MUÑOZ,,,,,,
18436,CUARTA,,  MUÑOZ  CERDA   ,MUÑOZ CERDA — QUINTANILLA — — ,2015-08-10 00:00:00,, —  QUINTANILLA — —  ,MUÑOZ,CERDA,—,QUINTANILLA,feriado,,,
18439,CUARTA,  FUENTES,  CISTERNAS CERDA   ,CISTERNAS CERDA  RODRIGUEZ PIZARRO ,2015-08-11 00:00:00,,  RODRIGUEZ  PIZARRO ,CISTERNAS,CERDA,,RODRIGUEZ,comisión,permiso,feriado,
18443,CUARTA,  CARRENO,  CHEVESICH  CERDA  LOS ,CHEVESICH CERDA LOS LAGOS CORREA ,2015-08-12 00:00:00,,  LAGOS  CORREA ,CHEVESICH,CERDA,LOS,LAGOS,comisión,feriado,,
18448,CUARTA,  FUENTES,  MUÑOZ SEOR CERDA   ,MUÑOZ SEOR CERDA  RODRIGUEZ ,2015-08-13 00:00:00,,  RODRIGUEZ   ,MUÑOZ,SEOR,CERDA,,comisión,feriado,,
18458,CUARTA,  FUENTES,  CISTERNAS CERDA   ,CISTERNAS CERDA  PIZARRO SEORA ETCHEBERRY ,2015-08-17 00:00:00,,  PIZARRO  SEORA ETCHEBERRY ,CISTERNAS,CERDA,,PIZARRO,comisión,feriado,,
18470,CUARTA,  CARREÑO,  CHEVESICH MUÑOZ  CERDA ,CHEVESICH MUÑOZ CERDA FIGUEROA,2015-08-19 00:00:00,,   FIGUEROA,CHEVESICH,MUÑOZ,CERDA,FIGUEROA,feriado,,,
18478,CUARTA,  CISTERNAS,  MUÑOZ  CERDA   ,MUÑOZ CERDA TCHEBERRY PRADO ,2015-08-20 00:00:00,,   TCHEBERRY   PRADO ,MUÑOZ,CERDA,TCHEBERRY,PRADO,comisión,feriado,,
18487,CUARTA,  FUENTES,  CHEVESICH SEOR CERDA  LOS ,CHEVESICH SEOR CERDA LOS ETCHEBERRY SETÑOR ,2015-08-24 00:00:00,,  ETCHEBERRY  SETÑOR ,CHEVESICH,SEOR,CERDA,LOS,licencia,permiso,,
18497,CUARTA,,  MUÑOZ SEOR CERDA   ,MUÑOZ SEOR CERDA  QUINTANILLA CORREA ,2015-08-25 00:00:00,,  QUINTANILLA  CORREA ,MUÑOZ,SEOR,CERDA,,licencia,,,
18508,CUARTA,  CARREÑO,  CHEVESICH MUÑOZ   ,CHEVESICH MUÑOZ  MA TUS PIZARRO ,2015-08-26 00:00:00,,  MA TUS  PIZARRO ,CHEVESICH,MUÑOZ,,MA,licencia,,,
18520,CUARTA,,  ARANGUIZ FISCAL:  ESCOBAR  ,ARANGUIZ FISCAL: ESCOBAR PIZARRO CORREA ,2015-08-27 00:00:00,,  PIZARRO  CORREA ,ARANGUIZ,FISCAL:,ESCOBAR,PIZARRO,licencia,subroga,,
18544,CUARTA,  KUNSEMULLER,  CISTERNAS  CHEVESICH  LOS ,CISTERNAS CHEVESICH LOS MA TUS LAGOS ,2015-08-31 00:00:00,,  MA TUS  LAGOS ,CISTERNAS,CHEVESICH,LOS,MA,licencia,,,
18571,CUARTA,,  MUÑOZ  CERDA   ,MUÑOZ CERDA  ETCHEBERRY CORREA ,2015-08-06 00:00:00,,  ETCHEBERRY   CORREA ,MUÑOZ,CERDA,,ETCHEBERRY,feriado,,,
18586,CUARTA,  BRITO,  MUNOZ  CERDA   ,MUNOZ CERDA TCHEBERRY CORREA ,2015-08-05 00:00:00,,   TCHEBERRY   CORREA ,MUNOZ,CERDA,TCHEBERRY,CORREA,comisión,feriado,,
18602,CUARTA,,  MUÑOZ  CERDA   ,MUÑOZ CERDA  LAGOS CORREA ,2015-08-04 00:00:00,,  LAGOS  CORREA ,MUÑOZ,CERDA,,LAGOS,feriado,,,
18619,CUARTA,,  MUÑOZ  CERDA   ,MUÑOZ CERDA  PIZARRO ETCHEBERRY ,2015-08-03 00:00:00,,  PIZARRO   ETCHEBERRY ,MUÑOZ,CERDA,,PIZARRO,feriado,,,
18622,CUARTA,,  CERDA  MINISTRO SUPLENTE:  ,CERDA MINISTRO SUPLENTE: PIZARRO ,2015-09-10 00:00:00,,  PIZARRO  ,CERDA,MINISTRO,SUPLENTE:,PIZARRO,licencia,feriado,,
18625,CUARTA,  CERDA,  VALDERRAMA  MINISTRO SUPLENTE: ,VALDERRAMA MINISTRO SUPLENTE: ,2015-09-14 00:00:00,,  ,VALDERRAMA,MINISTRO,SUPLENTE:,,licencia,comisión,feriado,
18629,CUARTA,  JUICA,  CERDA  MINISTRO SUPLENTE:  ,CERDA MINISTRO SUPLENTE: PIZARRO ,2015-09-15 00:00:00,,  PIZARRO ,CERDA,MINISTRO,SUPLENTE:,PIZARRO,licencia,comisión,feriado,
18634,* CUARTA,,  CERDA LOS MINISTROS SUPLENTES:  PFEIFFER MIRANDA,CERDA LOS MINISTROS SUPLENTES: PFEIFFER MIRANDA ,2015-09-16 00:00:00,"PFEIFFER, MIRANDA",  ,CERDA,LOS,MINISTROS,SUPLENTES:,licencia,feriado,,
18640,CUARTA,,  CERDA LOS MINISTROS SUPLENTES:  PFEIFFER MIRANDA,CERDA LOS MINISTROS SUPLENTES: PFEIFFER MIRANDA ,2015-09-17 00:00:00,"PFEIFFER, MIRANDA",  ,CERDA,LOS,MINISTROS,SUPLENTES:,licencia,feriado,,
18647,CUARTA,  JUICA,  SILVA SEORA MUÑOZ  CERDA  ,SILVA SEORA MUÑOZ CERDA ,2015-09-21 00:00:00,, ,SILVA,SEORA,MUÑOZ,CERDA,licencia,feriado,,
18655,CUARTA,,  CERDA  MINISTRO SUPLENTE:  ,CERDA MINISTRO SUPLENTE: PIZARRO ,2015-09-22 00:00:00,,  PIZARRO ,CERDA,MINISTRO,SUPLENTE:,PIZARRO,licencia,permiso,,
18664,CUARTA,,  CERDA  MINISTRO SUPLENTE:  ,CERDA MINISTRO SUPLENTE: MATUS ,2015-09-23 00:00:00,,  MATUS  ,CERDA,MINISTRO,SUPLENTE:,MATUS,licencia,permiso,,
18674,CUARTA,,  CERDA  MINISTRO SUPLENTE:  ,CERDA MINISTRO SUPLENTE: ,2015-09-24 00:00:00,,  ,CERDA,MINISTRO,SUPLENTE:,,licencia,permiso,,
18694,CUARTA,  KUNSEMULLER,  CHEVESICH MUÑOZ  1OS ABOGADOS ,CHEVESICH MUÑOZ 1OS ABOGADOS ETCHEBERR FIGUEROA ,2015-09-28 00:00:00,,  ETCHEBERR    FIGUEROA ,CHEVESICH,MUÑOZ,1OS,ABOGADOS,licencia,,,
18706,CUARTA,  PIERR Y,  CHEVESICH MUÑOZ   ,CHEVESICH MUÑOZ  PIZARRO ETCHEBERR ,2015-09-29 00:00:00,,  PIZARRO   ETCHEBERR  ,CHEVESICH,MUÑOZ,,PIZARRO,licencia,,,
18719,CUARTA,  JUICA,  KUNSEMULLER  CHEVESICH  ,KUNSEMULLER CHEVESICH PIZARRO RA ,2015-09-30 00:00:00,,  PIZARRO  RA ,KUNSEMULLER,CHEVESICH,PIZARRO,RA,licencia,,,
18745,CUARTA,  FUENTES,  VALDERRAMA  MINISTRO SUPLENTE: ,VALDERRAMA MINISTRO SUPLENTE: ,2015-09-08 00:00:00,,  ,VALDERRAMA,MINISTRO,SUPLENTE:,,licencia,feriado,,
18760,CUARTA,,,,2015-09-07 00:00:00,, ,,,,,licencia,feriado,,
18791,CUARTA,,  MUÑOZ  VALDERRAMA  LOS ,MUÑOZ VALDERRAMA LOS PIZARRO ,2015-09-03 00:00:00,,  PIZARRO   ,MUÑOZ,VALDERRAMA,LOS,PIZARRO,licencia,feriado,,
18808,CUARTA,,  MUÑOZ  VALDERRAMA  1OS ,MUÑOZ VALDERRAMA 1OS MATUS ' ,2015-09-02 00:00:00,,  MATUS  '  ,MUÑOZ,VALDERRAMA,1OS,MATUS,licencia,,,
18826,CUARTA,  KUNSEMULLER,  CISTERNAS  CHEVESICH  LOS ,CISTERNAS CHEVESICH LOS LAGOS ' ,2015-09-01 00:00:00,,  LAGOS  '  ,CISTERNAS,CHEVESICH,LOS,LAGOS,licencia,,,
18829,CUARTA,  BLANCO,  MUNOZ  MINISTRO SUPLENTE:  ,MUNOZ MINISTRO SUPLENTE: ,2015-10-13 00:00:00,,  ,MUNOZ,MINISTRO,SUPLENTE:,,licencia,,,
18832,CUARTA,  BLANCO,  MUÑOZ  CERDA  MINISTRO SUPLENTE:  PFEIFFER,MUÑOZ CERDA MINISTRO SUPLENTE: PFEIFFER ,2015-10-14 00:00:00,SUPLENTE: SEÑOR PFEIFFER,  ,MUÑOZ,CERDA,MINISTRO,SUPLENTE:,licencia,,,
18838,CUARTA,  JUICA,  DOLMESTCH BLANCO   LOS ,DOLMESTCH BLANCO LOS ETCHEBERRY SETÑOR ,2015-10-19 00:00:00,,  ETCHEBERRY  SETÑOR ,DOLMESTCH,BLANCO,LOS,ETCHEBERRY,licencia,comisión,subroga,
18843,CUARTA,  BLANCO,  MUÑOZ  CERDA   ,MUÑOZ CERDA  ETCHEBERRY SSÑOR CORREA ,2015-10-20 00:00:00,,  ETCHEBERRY  SSÑOR CORREA ,MUÑOZ,CERDA,,ETCHEBERRY,licencia,,,
18849,CUARTA,  BLANCO,,MATUS ,2015-10-21 00:00:00,,  MATUS ,MATUS,,,,licencia,,,
18856,CUARTA,  BLANCO,  MUÑOZ  CERDA  LOS ,MUÑOZ CERDA LOS LAGOS CORREA ,2015-10-22 00:00:00,,  LAGOS  CORREA ,MUÑOZ,CERDA,LOS,LAGOS,licencia,permiso,,
18882,CUARTA,  JUICA,  CISTERNAS BLANCO ..  ,CISTERNAS BLANCO .. ,2015-10-26 00:00:00,, ,CISTERNAS,BLANCO,..,,subroga,,,
18891,CUARTA,  BLANCO,  CHEVESICH MUÑOZ   ,CHEVESICH MUÑOZ  LAGOS FIGUEROA ,2015-10-27 00:00:00,,  LAGOS  FIGUEROA ,CHEVESICH,MUÑOZ,,LAGOS,subroga,,,
18901,CUARTA,,  MUÑOZ  DAHM   ,MUÑOZ DAHM  LAGOS GOMEZ ,2015-10-28 00:00:00,,  LAGOS  GOMEZ ,MUÑOZ,DAHM,,LAGOS,,,,
18912,CUARTA,  BLANCO,  CHEVESICH MUÑOZ   ,CHEVESICH MUÑOZ  ETCHEBERRY CORREA ,2015-10-29 00:00:00,,  ETCHEBERRY   CORREA ,CHEVESICH,MUÑOZ,,ETCHEBERRY,subroga,,,
18944,CUARTA,  JUICA,  DOLMESTCH  MINISTRO SUPLENTE: ,DOLMESTCH MINISTRO SUPLENTE: ,2015-10-08 00:00:00,,  ,DOLMESTCH,MINISTRO,SUPLENTE:,,licencia,subroga,,
18957,CUARTA,,  CHEVESICH MUÑOZ   ,CHEVESICH MUÑOZ  QUINTANILLA PRADO ,2015-10-07 00:00:00,,  QUINTANILLA  PRADO ,CHEVESICH,MUÑOZ,,QUINTANILLA,licencia,,,
18971,CUARTA,,  MUÑOZ  CERDA   ,MUÑOZ CERDA  ETCHEBERRY CORREA ,2015-10-06 00:00:00,,  ETCHEBERRY   CORREA ,MUÑOZ,CERDA,,ETCHEBERRY,licencia,,,
18986,CUARTA,,  MUNOZ  CERDA   ,MUNOZ CERDA  PIZARRO CORREA ,2015-10-05 00:00:00,,  PIZARRO  CORREA ,MUNOZ,CERDA,,PIZARRO,licencia,,,
19016,CUARTA,  BRITO,  CHEVESICH MUÑOZ   ,CHEVESICH MUÑOZ  QUINTANILLA CORREA ,2015-10-01 00:00:00,,  QUINTANILLA  CORREA ,CHEVESICH,MUÑOZ,,QUINTANILLA,licencia,,,
19019,CUARTA,,  CERDA DAHM   ,CERDA DAHM  PIZARRO GOMEZ ,2015-11-11 00:00:00,,  PIZARRO  GOMEZ ,CERDA,DAHM,,PIZARRO,comisión,,,
19022,CUARTA,  ARÁNGUIZ,  VALDERRAMA DAHM  LOS ,VALDERRAMA DAHM LOS PIZARRO RA ,2015-11-12 00:00:00,,  PIZARRO  RA ,VALDERRAMA,DAHM,LOS,PIZARRO,comisión,,,
19026,CUARTA,  CARREÑO,  BLANCO  CHEVESICH MUÑOZ,BLANCO CHEVESICH MUÑOZ CORREA,2015-11-16 00:00:00,MUÑOZ,   CORREA,BLANCO,CHEVESICH,MUÑOZ,CORREA,permiso,subroga,,
19031,CUARTA,  BLANCO,  CHEVESICH  FISCAL:  ,CHEVESICH FISCAL: PIZARRO ,2015-11-17 00:00:00,,  PIZARRO  ,CHEVESICH,FISCAL:,PIZARRO,,permiso,subroga,,
19037,CUARTA,  BLANCO,  CHEVESICH  MUÑOZ  LOS ,CHEVESICH MUÑOZ LOS IMATUS ,2015-11-18 00:00:00,,  IMATUS    ,CHEVESICH,MUÑOZ,LOS,IMATUS,permiso,subroga,,
19044,CUARTA,  BLANCO,  CHEVESICH  MUÑOZ   RLOS ,CHEVESICH MUÑOZ RLOS PIZARRO CORREA ,2015-11-19 00:00:00,,  PIZARRO  CORREA ,CHEVESICH,MUÑOZ,RLOS,PIZARRO,comisión,subroga,,
19058,CUARTA,  BLANCO,  CHEVESICH MUÑOZ  CERDA ,CHEVESICH MUÑOZ CERDA ETCHEBERRY,2015-11-23 00:00:00,,   ETCHEBERRY,CHEVESICH,MUÑOZ,CERDA,ETCHEBERRY,subroga,,,
19067,CUARTA,  JUICA,  BRITO BLANCO  MUÑOZ  ,BRITO BLANCO MUÑOZ ,2015-11-24 00:00:00,, ,BRITO,BLANCO,MUÑOZ,,comisión,,,
19077,CUARTA,  BLANCO,  MUÑOZ  CERDA   ,MUÑOZ CERDA  QUINTANILLA LAGOS ,2015-11-25 00:00:00,,  QUINTANILLA  LAGOS ,MUÑOZ,CERDA,,QUINTANILLA,comisión,permiso,,
19110,CUARTA,  BLANCO,   CHEVESICH MUÑOZ  ,CHEVESICH MUÑOZ  QUINTANILLA,2015-11-30 00:00:00,,   QUINTANILLA,CHEVESICH,MUÑOZ,,QUINTANILLA,,,,
19123,CUARTA,  CARREÑO,  CHEVESICH  CERDA DAHM ,CHEVESICH CERDA DAHM ETCHEBERR ,2015-11-09 00:00:00,,   ETCHEBERR ,CHEVESICH,CERDA,DAHM,ETCHEBERR,comisión,,,
19146,CUARTA,  BLANCO,  CERDA DAHM   ,CERDA DAHM  MA TUS ETCHEBERRY ,2015-11-05 00:00:00,,  MA TUS   ETCHEBERRY ,CERDA,DAHM,,MA,comisión,permiso,,
19161,CUARTA,  DOLMESTCHIL,  BLANCO  CHEVESICH  1OS ,BLANCO CHEVESICH 1OS LAGOS CORREA ,2015-11-04 00:00:00,,  LAGOS  CORREA ,BLANCO,CHEVESICH,1OS,LAGOS,permiso,,,
19177,CUARTA,  BLANCO,  CHEVESICH ¡WMUÑOZ SEÑOORES ,CHEVESICH ¡WMUÑOZ SEÑOORES ,2015-11-03 00:00:00,, ,CHEVESICH,¡WMUÑOZ,SEÑOORES,,,,,
19192,CUARTA,  JUICA,  DOLMESTCH BLANCO  ,DOLMESTCH BLANCO ,2015-11-02 00:00:00,, ,DOLMESTCH,BLANCO,,,,,,
19195,CUARTA,  BLANCO,  MUÑOZ  CERDA DAHM  ,MUÑOZ CERDA DAHM  ETCHEBERRY,2015-12-10 00:00:00,,   ETCHEBERRY,MUÑOZ,CERDA,DAHM,,comisión,,,
19199,CUARTA,  BLANCO,  CHEVESICH SETÑOR CERDA  LOS ,CHEVESICH SETÑOR CERDA LOS ETCHEBERRY ,2015-12-14 00:00:00,,  ETCHEBERRY   ,CHEVESICH,SETÑOR,CERDA,LOS,comisión,subroga,,
19203,CUARTA,  BRITO,  CISTERNAS £BLANCO  ,CISTERNAS £BLANCO ,2015-12-15 00:00:00,, ,CISTERNAS,£BLANCO,,,subroga,,,
19208,CUARTA,  BLANCO,  CHEVESICH 17MUÑOZ SRÑOREES ,CHEVESICH 17MUÑOZ SRÑOREES ,2015-12-16 00:00:00,, ,CHEVESICH,17MUÑOZ,SRÑOREES,,,,,
19214,CUARTA,  BLANCO,  * MUÑOZ  CERDA DAHM  LA ,* MUÑOZ CERDA DAHM LA ETCHEBERRY,2015-12-17 00:00:00,,   ETCHEBERRY,*,MUÑOZ,CERDA,DAHM,comisión,,,
19226,CUARTA,  JUICA,  * BLANCO SETÑORA MUÑOZ  LOS ,* BLANCO SETÑORA MUÑOZ LOS PIZARRO ,2015-12-21 00:00:00,,  PIZARRO   ,*,BLANCO,SETÑORA,MUÑOZ,comisión,subroga,,
19240,CUARTA,  CISTERNAS,  * BLANCO  MUÑOZ  ,* BLANCO MUÑOZ ,2015-12-23 00:00:00,, ,*,BLANCO,MUÑOZ,,,,,
19249,CUARTA,  BLANCO,  CHEVESICH MUÑOZ —  ,CHEVESICH MUÑOZ —  ETCHEBERRY,2015-12-28 00:00:00,,   ETCHEBERRY,CHEVESICH,MUÑOZ,—,,comisión,,,
19259,CUARTA,  BLANCO,   CHEVESICH MUÑOZ  ,CHEVESICH MUÑOZ ,2015-12-29 00:00:00,, ,CHEVESICH,MUÑOZ,,,,,,
19270,CUARTA,  BLANCO,  MUÑOZ SRÑOR CERDA   ,MUÑOZ SRÑOR CERDA — RODRÍGUEZ — ,2015-12-30 00:00:00,, —   RODRÍGUEZ  —  ,MUÑOZ,SRÑOR,CERDA,—,comisión,subroga,,
19282,CUARTA,  BLANCO,  CHEVESICH MUÑOZ  CERDA,CHEVESICH MUÑOZ CERDA LAGOS,2015-12-31 00:00:00,CERDA,   LAGOS,CHEVESICH,MUÑOZ,CERDA,LAGOS,subroga,,,
19295,CUARTA,,  TCHEVESICH MUÑOZ  ,TCHEVESICH MUÑOZ ,2015-12-09 00:00:00,, ,TCHEVESICH,MUÑOZ,,,,,,
19309,CUARTA,  BLANCO,  —CHEVESICH  CERDA DAHM,—CHEVESICH CERDA DAHM CORREA,2015-12-07 00:00:00,DAHM,   CORREA,—CHEVESICH,CERDA,DAHM,CORREA,permiso,,,
19337,CUARTA,  BLANCO,  MUÑOZ  CERDA DAHM   ,MUÑOZ CERDA DAHM GOMEZ,2015-12-03 00:00:00,,   GOMEZ,MUÑOZ,CERDA,DAHM,GOMEZ,comisión,,,
19367,CUARTA,  BLANCO,  CHEVESICH MUÑOZ  CERDA ,CHEVESICH MUÑOZ CERDA CORREA,2015-12-01 00:00:00,,   CORREA,CHEVESICH,MUÑOZ,CERDA,CORREA,subroga,,,
19370,CUARTA,  MUÑOZ,  BLANCO  CHEVESICH ,BLANCO CHEVESICH ,2016-01-11 00:00:00,, ,BLANCO,CHEVESICH,,,,,,
19374,CUARTA,  MUÑOZ,  BLANCO SETÑORAS CHEVESICH ,BLANCO SETÑORAS CHEVESICH ,2016-01-12 00:00:00,, ,BLANCO,SETÑORAS,CHEVESICH,,,,,
19377,CUARTA,  MUÑOZ,  BLANCO  CHEVESICH ,BLANCO CHEVESICH ,2016-01-13 00:00:00,, ,BLANCO,CHEVESICH,,,,,,
19382,CUARTA,  MUÑOZ,  BLANCO  CHEVESICH ,BLANCO CHEVESICH ,2016-01-14 00:00:00,, ,BLANCO,CHEVESICH,,,,,,
19392,CUARTA,  MUÑOZ,  BLANCO  CHEVESICH ,BLANCO CHEVESICH ,2016-01-18 00:00:00,, ,BLANCO,CHEVESICH,,,,,,
19399,CUARTA,  MUÑOZ,  BLANCO  CHEVESICH MUÑOZ,BLANCO CHEVESICH MUÑOZ PIZARRO,2016-01-19 00:00:00,MUÑOZ,   PIZARRO,BLANCO,CHEVESICH,MUÑOZ,PIZARRO,subroga,,,
19407,CUARTA,  MUÑOZ,  BLANCO  MUÑOZ —  CERDA,BLANCO MUÑOZ — CERDA PIZARRO,2016-01-20 00:00:00,CERDA,   PIZARRO,BLANCO,MUÑOZ,—,CERDA,comisión,,,
19417,CUARTA,  MUÑOZ,  BLANCO  CHEVESICH ,BLANCO CHEVESICH ,2016-01-21 00:00:00,, ,BLANCO,CHEVESICH,,,,,,
19435,CUARTA,  MUÑOZ,  BLANCO  CHEVESICH  ,BLANCO CHEVESICH  ETCHEBERRY,2016-01-25 00:00:00,,   ETCHEBERRY,BLANCO,CHEVESICH,,ETCHEBERRY,permiso,,,
19446,CUARTA,  MUÑOZ,  BELANCO CERDA   ,BELANCO CERDA  ETCHEBERRY CORREA ,2016-01-26 00:00:00,,  ETCHEBERRY   CORREA ,BELANCO,CERDA,,ETCHEBERRY,permiso,,,
19458,CUARTA,  MUÑOZ,  BLANCO  CHEVESICH ,BLANCO CHEVESICH ,2016-01-27 00:00:00,, ,BLANCO,CHEVESICH,,,,,,
19471,CUARTA,  MUÑOZ,  BLANCO  MUÑOZ  TLOS ,BLANCO MUÑOZ TLOS PIZARRO CORREA ,2016-01-28 00:00:00,,  PIZARRO  CORREA ,BLANCO,MUÑOZ,TLOS,PIZARRO,permiso,,,
19521,CUARTA,  MUNOZ,  BLANCO  CHEVESICH ,BLANCO CHEVESICH ,2016-01-06 00:00:00,, ,BLANCO,CHEVESICH,,,subroga,,,
19537,CUARTA,  BLANCO,  CHEVESICH MUÑOZ  DAHM ,CHEVESICH MUÑOZ DAHM ETCHEBERRY,2016-01-05 00:00:00,,   ETCHEBERRY,CHEVESICH,MUÑOZ,DAHM,ETCHEBERRY,subroga,,,
19553,CUARTA,  BLANCO,  CHEVESICH MUÑOZ  ,CHEVESICH MUÑOZ ,2016-01-04 00:00:00,, ,CHEVESICH,MUÑOZ,,,,,,
19556,CUARTA,  MUÑOZ,  CHEVESICH MUÑOZ   ,CHEVESICH MUÑOZ  PIZARRO ETCHEBERRY ,2016-03-10 00:00:00,,  PIZARRO   ETCHEBERRY ,CHEVESICH,MUÑOZ,,PIZARRO,comisión,permiso,,
19560,CUARTA,  MUÑOZ, < BLANCO  CHEVESICH ,< BLANCO CHEVESICH ,2016-03-14 00:00:00,, ,<,BLANCO,CHEVESICH,,licencia,,,
19564,CUARTA,"  MUÑOZ,",  BLANCO  CHEVESICH ,BLANCO CHEVESICH ,2016-03-15 00:00:00,,  ,BLANCO,CHEVESICH,,,licencia,,,
19569,CUARTA,  BLANCO,  CHEVESICH MUÑOZ   ,CHEVESICH MUÑOZ  QUINTANILLA MATUS ,2016-03-16 00:00:00,,  QUINTANILLA  MATUS ,CHEVESICH,MUÑOZ,,QUINTANILLA,licencia,comisión,,
19575,CUARTA,  BLANCO,  CHEVESICH MUÑOZ  1OS ABOGADOS ,CHEVESICH MUÑOZ 1OS ABOGADOS ETCHEBERRY CORREA ,2016-03-17 00:00:00,,  ETCHEBERRY   CORREA ,CHEVESICH,MUÑOZ,1OS,ABOGADOS,licencia,comisión,,
19587,CUARTA,  BLANCO,  MUÑOZ  VALDERRAMA  1OS ,MUÑOZ VALDERRAMA 1OS LAGOS ,2016-03-21 00:00:00,,  LAGOS   ,MUÑOZ,VALDERRAMA,1OS,LAGOS,licencia,comisión,permiso,
19595,CUARTA,  BLANCO,  CHEVESICH MUÑOZ   ,CHEVESICH MUÑOZ  ETCHEBERRY SEOR CORREA ,2016-03-22 00:00:00,,  ETCHEBERRY  SEOR CORREA ,CHEVESICH,MUÑOZ,,ETCHEBERRY,licencia,permiso,,
19604,CUARTA,  BLANCO,  CHEVESICH MUÑOZ   ,CHEVESICH MUÑOZ  RODRIGUEZ LAGOS ,2016-03-23 00:00:00,,  RODRIGUEZ  LAGOS ,CHEVESICH,MUÑOZ,,RODRIGUEZ,licencia,permiso,,
19614,CUARTA,  MUÑOZ,  BLANCO SRÑORAS CHEVESICH MUNOZ,BLANCO SRÑORAS CHEVESICH MUNOZ CORRE,2016-03-24 00:00:00,MUNOZ,   CORRE,BLANCO,SRÑORAS,CHEVESICH,MUNOZ,,,,
19625,CUARTA,  MUÑOZ,  BLANCO  CHEVESICH ,BLANCO CHEVESICH ETCHEBERRY,2016-03-28 00:00:00,,   ETCHEBERRY,BLANCO,CHEVESICH,ETCHEBERRY,,licencia,,,
19637,instalar la CUARTA,  MUNOZ,  BLANCO  CHEVESICH ,BLANCO CHEVESICH ,2016-03-29 00:00:00,, ,BLANCO,CHEVESICH,,,licencia,,,
19650,instalar la CUARTA,  MUNOZ,  BLANCO  CHE MUÑOZ,BLANCO CHE MUÑOZ CORREA,2016-03-30 00:00:00,MUÑOZ,   CORREA,BLANCO,CHE,MUÑOZ,CORREA,licencia,,,
19664,CUARTA,  MUÑOZ,  BLANCO  CHEVESICH MUÑOZ,BLANCO CHEVESICH MUÑOZ MATUS,2016-03-31 00:00:00,MUÑOZ,   MATUS,BLANCO,CHEVESICH,MUÑOZ,MATUS,licencia,,,
19679,CUARTA,  MUÑOZ,  CHEVESICH MUÑOZ  CERDA ,CHEVESICH MUÑOZ CERDA CORREA,2016-03-09 00:00:00,,   CORREA,CHEVESICH,MUÑOZ,CERDA,CORREA,feriado,,,
19695,CUARTA,  MUNOZ,  CHEVESICH MUÑOZ  CERDA ,CHEVESICH MUÑOZ CERDA PIZARRO,,,   PIZARRO,CHEVESICH,MUÑOZ,CERDA,PIZARRO,feriado,,,
19712,CUARTA,  MUÑOZ,  SANDOVAL CHEVESICH MUÑOZ ,SANDOVAL CHEVESICH MUÑOZ ,2016-03-07 00:00:00,, ,SANDOVAL,CHEVESICH,MUÑOZ,,feriado,,,
19746,CUARTA,  MUÑOZ,  CHEVESICH  CERDA  LOS ,CHEVESICH CERDA LOS MA TUS CORREA ,2016-03-03 00:00:00,,  MA TUS  CORREA ,CHEVESICH,CERDA,LOS,MA,feriado,,,
19765,CUARTA,  MUÑOZ,  CHEVESICH  CERDA VALDERRAMA,CHEVESICH CERDA VALDERRAMA ,2016-03-02 00:00:00,VALDERRAMA,  ,CHEVESICH,CERDA,VALDERRAMA,,feriado,,,
19785,CUARTA,  * BLANCO,  CHEVESICH MUNOZ  FISCAL JUDICIAL:  ESCOBAR,CHEVESICH MUNOZ FISCAL JUDICIAL: ESCOBAR ,2016-04-11 00:00:00,JUDICIAL: SEÑOR ESCOBAR, ,CHEVESICH,MUNOZ,FISCAL,JUDICIAL:,licencia,permiso,,
19788,CUARTA, 9 BLANCO,  CHEVESICH MUÑOZ   ,CHEVESICH MUÑOZ  QUINTANILLA CORREA ,2016-04-12 00:00:00,,  QUINTANILLA  CORREA ,CHEVESICH,MUÑOZ,,QUINTANILLA,comisión,,,
19792,CUARTA,  CARREÑO,  BLANCO  CHEVESICH MUÑOZ,BLANCO CHEVESICH MUÑOZ PIZARRO,2016-04-13 00:00:00,MUÑOZ,   PIZARRO,BLANCO,CHEVESICH,MUÑOZ,PIZARRO,licencia,comisión,,
19797,CUARTA,  BLANCO,  MUNOZ  FISCAL JUDICIAL:  ,MUNOZ FISCAL JUDICIAL: PIZARRO ,2016-04-14 00:00:00,,  PIZARRO ,MUNOZ,FISCAL,JUDICIAL:,PIZARRO,licencia,comisión,,
19807,CUARTA,  MUÑOZ,  BLANCO « CHEVESICH MUÑOZ,BLANCO « CHEVESICH MUÑOZ PIZARRO,2016-04-18 00:00:00,MUÑOZ,   PIZARRO,BLANCO,«,CHEVESICH,MUÑOZ,licencia,,,
19814,CUARTA,  MUÑOZ,  BLANCO <SEEÑORAS ÑCHEVESICH MUÑOZ,BLANCO <SEEÑORAS ÑCHEVESICH MUÑOZ PIZARRO,2016-04-19 00:00:00,MUÑOZ,   PIZARRO,BLANCO,<SEEÑORAS,ÑCHEVESICH,MUÑOZ,licencia,,,
19822,CUARTA,  MUÑOZ,  BLANCO *EÑORAS  CHEVESICH ,BLANCO *EÑORAS CHEVESICH ,2016-04-20 00:00:00,, ,BLANCO,*EÑORAS,CHEVESICH,,licencia,,,
19831,CUARTA,  MUÑOZ,  BLANCO  CHEVESICH  ,BLANCO CHEVESICH  ETCHEBERRY,2016-04-21 00:00:00,,   ETCHEBERRY,BLANCO,CHEVESICH,,ETCHEBERRY,licencia,subroga,,
19849,CUARTA,  MUÑOZ,  BRITO CISTERNAS BLANCO  ,BRITO CISTERNAS BLANCO ,2016-04-25 00:00:00,, ,BRITO,CISTERNAS,BLANCO,,licencia,,,
19860,CUARTA,  MUÑOZ,  BLANCO DAHM   ,BLANCO DAHM  ETCHEBERRY CORREA ,2016-04-26 00:00:00,,  ETCHEBERRY   CORREA ,BLANCO,DAHM,,ETCHEBERRY,licencia,permiso,,
19872,CUARTA,  SILVA,  DBLANCO  MUÑOZ  VALDERRAMA,DBLANCO MUÑOZ VALDERRAMA ,2016-04-27 00:00:00,VALDERRAMA,  ,DBLANCO,MUÑOZ,VALDERRAMA,,licencia,comisión,,
19885,CUARTA,  ARANGUIZ,  MUNOZ  FISCAL:  ESCOBAR  ,MUNOZ FISCAL: ESCOBAR PIZARRO ,2016-04-28 00:00:00,,  PIZARRO   ,MUNOZ,FISCAL:,ESCOBAR,PIZARRO,licencia,comisión,,
19923,CUARTA,  MUNOZ,  BLANCO SRÑORAS CHEVESICH ,BLANCO SRÑORAS CHEVESICH ,,, ,BLANCO,SRÑORAS,CHEVESICH,,licencia,,,
19938,CUARTA,  MUÑOZ,  BLANCO  CHEVESICH MUÑOZ,BLANCO CHEVESICH MUÑOZ LAGOS,2016-04-06 00:00:00,MUÑOZ,   LAGOS,BLANCO,CHEVESICH,MUÑOZ,LAGOS,licencia,,,
19954,CUARTA,  MUÑOZ,  BLANCO  CHEVESICH ,BLANCO CHEVESICH ETCHEBERRY,2016-04-05 00:00:00,,   ETCHEBERRY,BLANCO,CHEVESICH,ETCHEBERRY,,licencia,,,
19971,CUARTA,  MUNOZ,  BLANCO  CHEVESICH  LOS ,BLANCO CHEVESICH LOS MA TUS RODRIGUEZ ,2016-04-04 00:00:00,,  MA TUS  RODRIGUEZ ,BLANCO,CHEVESICH,LOS,MA,licencia,comisión,,
19989,CUARTA,  MUÑOZ,  BLANCO  CHEVESICH  LOS ,BLANCO CHEVESICH LOS RODRIGUEZ LAGOS ,2016-05-10 00:00:00,,  RODRIGUEZ  LAGOS ,BLANCO,CHEVESICH,LOS,RODRIGUEZ,comisión,feriado,,
19992,CUARTA,  MUÑOZ,  BLANCO  CHEVESICH  LOS ,BLANCO CHEVESICH LOS PIZARRO VY RA ,2016-05-11 00:00:00,,  PIZARRO VY RA ,BLANCO,CHEVESICH,LOS,PIZARRO,comisión,feriado,,
19996,- CUARTA,  MUÑOZ |,  BLANCO  CHEVESICH  LOS ,BLANCO CHEVESICH LOS ETCHEBERRY - ,2016-05-12 00:00:00,,  ETCHEBERRY   - ,BLANCO,CHEVESICH,LOS,ETCHEBERRY,comisión,feriado,,
20004,CUARTA, SENOR MUÑOZ,  BLANCO  CHEVESICH  ,BLANCO CHEVESICH  ETCHEBERRY,2016-05-16 00:00:00,,   ETCHEBERRY,BLANCO,CHEVESICH,,ETCHEBERRY,feriado,,,
20010,CUARTA,  BLANCO,  CHEVESICH SEOR CERDA  LOS ,CHEVESICH SEOR CERDA LOS PIZARRO CORREA ,,,  PIZARRO  CORREA ,CHEVESICH,SEOR,CERDA,LOS,comisión,feriado,,
20017,CUARTA,  BLANCO,  CHEVESICH SEOR CERDA  LOS ,CHEVESICH SEOR CERDA LOS ETCHEBERRY ,2016-05-18 00:00:00,,  ETCHEBERRY   ,CHEVESICH,SEOR,CERDA,LOS,comisión,feriado,,
20025,CUARTA,  BLANCO,  CHEVESICH  CERDA  LOS ,"CHEVESICH CERDA LOS RODRÍGUEZ, CORREA ",2016-05-19 00:00:00,,"  RODRÍGUEZ,  CORREA ",CHEVESICH,CERDA,LOS,RODRÍGUEZ,permiso,feriado,,
20041,; | CUARTA,  BLANCO,  VALDERRAMA  FISCAL JUDICIAL:  ,VALDERRAMA FISCAL JUDICIAL: PIZARRO ,2016-05-23 00:00:00,,  PIZARRO  ,VALDERRAMA,FISCAL,JUDICIAL:,PIZARRO,comisión,permiso,feriado,
20051,CUARTA,  BLAN CO,,PIZARRO ,,,  PIZARRO  ,PIZARRO,,,,comisión,permiso,feriado,
20062,CUARTA,  BLANCO,,,2016-05-25 00:00:00,,  ,,,,,licencia,comisión,feriado,
20074,CUARTA,  BLANCO,,CORREA,,,   CORREA,CORREA,,,,licencia,comisión,feriado,
20112,CUARTA,  BLANCO,  CHEVESICH  CERDA EER ,CHEVESICH CERDA EER QUINTANILLA,2016-05-31 00:00:00,,   QUINTANILLA,CHEVESICH,CERDA,EER,QUINTANILLA,feriado,,,
20127,CUARTA,  MUÑOZ,  BLANCO SEORA CHEVESICH  LOS ,BLANCO SEORA CHEVESICH LOS MATUS ,2016-05-09 00:00:00,,  MATUS   ,BLANCO,SEORA,CHEVESICH,LOS,comisión,feriado,,
20157,instalar la CUARTA,  MUNOZ,  PIERRY BLANCO  MUÑOZ  ,PIERRY BLANCO MUÑOZ ,2016-05-05 00:00:00,, ,PIERRY,BLANCO,MUÑOZ,,licencia,,,
20174,CUARTA,  BLANCO,  IMUÑOZ —  CERDA VALDERRAMA,IMUÑOZ — CERDA VALDERRAMA ,2016-05-04 00:00:00,VALDERRAMA,  ,IMUÑOZ,—,CERDA,VALDERRAMA,licencia,,,
